{
  "$schema": "https://json-schema.org/draft/2020-12/schema",
  "$id": "flow.schema.json",
  "title": "Agentic Flow",
  "description": "A parameterized test sequence that agents execute against a running MetaMask Mobile app via CDP. Flows combine navigation, UI interaction, and state assertions into a reproducible validation sequence.",
  "type": "object",
  "required": ["title", "validate"],
  "additionalProperties": false,
  "properties": {
    "title": {
      "type": "string",
      "description": "Human-readable title. May contain {{param}} template tokens that resolve at runtime."
    },
    "schema_version": {
      "type": ["string", "number"],
      "description": "Opt-in strict-validation marker. Set to 1 to require fields like screenshot `note`. Recipes without this field (legacy/demo) only get console warnings instead of validation errors. Bump in future versions when adopting additional strict rules."
    },
    "pr": {
      "type": ["string", "number"],
      "description": "Associated PR number (informational)."
    },
    "inputs": {
      "type": "object",
      "description": "Declared parameters. Every {{param}} used in steps MUST have a matching key here. Params without a default are required.",
      "additionalProperties": {
        "type": "object",
        "required": ["type"],
        "properties": {
          "type": {
            "type": "string",
            "enum": ["string", "number", "boolean"],
            "description": "Informational type hint (no runtime type checking)."
          },
          "default": {
            "description": "Default value. If present, the param is optional. Single source of truth — prefer this over inline {{param|default}} syntax."
          },
          "description": {
            "type": "string",
            "description": "What this parameter controls."
          }
        },
        "additionalProperties": false
      }
    },
    "initial_conditions": {
      "type": "object",
      "description": "App state to establish before running steps.",
      "properties": {
        "account": { "type": "string", "description": "Ethereum address to switch to." },
        "testnet": { "type": "boolean", "description": "Enable/disable testnet mode." },
        "provider": { "type": "string", "description": "Active provider (hyperliquid, myx, aggregated)." }
      },
      "additionalProperties": false
    },
    "validate": {
      "type": "object",
      "required": ["runtime"],
      "additionalProperties": false,
      "properties": {
        "runtime": {
          "type": "object",
          "required": ["steps"],
          "additionalProperties": false,
          "properties": {
            "pre_conditions": {
              "type": "array",
              "description": "Checks that must pass before steps run. String refs or parameterized objects.",
              "items": {
                "oneOf": [
                  {
                    "type": "string",
                    "description": "Named pre-condition (e.g. 'wallet.unlocked'). Shorthand 'name(k=v)' is also supported."
                  },
                  {
                    "type": "object",
                    "required": ["name"],
                    "properties": {
                      "name": { "type": "string", "description": "Pre-condition registry key." }
                    },
                    "additionalProperties": { "type": "string" },
                    "description": "Parameterized pre-condition (e.g. { name: 'perps.open_position', symbol: 'BTC' })."
                  }
                ]
              }
            },
            "initial_conditions": {
              "type": "object",
              "description": "Same as top-level initial_conditions (nested form for backward compat).",
              "properties": {
                "account": { "type": "string" },
                "testnet": { "type": "boolean" },
                "provider": { "type": "string" }
              },
              "additionalProperties": false
            },
            "steps": {
              "type": "array",
              "minItems": 1,
              "description": "Ordered sequence of actions. Terminal step MUST assert.",
              "items": { "$ref": "#/$defs/step" }
            }
          }
        }
      }
    }
  },
  "$defs": {
    "assert": {
      "type": "object",
      "required": ["operator"],
      "additionalProperties": false,
      "description": "Assertion applied to step result.",
      "properties": {
        "operator": {
          "type": "string",
          "enum": ["not_null", "eq", "neq", "gt", "length_eq", "length_gt", "contains", "not_contains"],
          "description": "Comparison operator."
        },
        "field": {
          "type": ["string", "null"],
          "description": "Dot-path into the result JSON to extract the actual value (e.g. 'route', 'positions.0.symbol'). Null or omitted = use entire result."
        },
        "value": {
          "description": "Expected value for eq/gt/length_eq/length_gt/contains/not_contains. Not used for not_null."
        }
      }
    },
    "step": {
      "type": "object",
      "required": ["id", "action"],
      "properties": {
        "id": {
          "type": "string",
          "description": "Unique step identifier. Use descriptive kebab-case (e.g. 'assert-route', 'press-close')."
        },
        "description": {
          "type": "string",
          "description": "Optional human note. Only add when the id + action aren't self-explanatory."
        },
        "action": {
          "type": "string",
          "enum": [
            "navigate", "eval_sync", "eval_async", "eval_ref",
            "press", "scroll", "set_input", "type_keypad", "clear_keypad",
            "call", "log_watch", "wait", "wait_for", "screenshot", "manual",
            "select_account", "toggle_testnet", "switch_provider"
          ]
        },
        "assert": { "$ref": "#/$defs/assert" }
      },
      "allOf": [
        {
          "if": { "properties": { "action": { "const": "navigate" } } },
          "then": {
            "properties": {
              "target": { "type": "string", "description": "Route name (e.g. 'PerpsMarketDetails')." },
              "params": { "type": "object", "description": "Navigation params (route-specific)." }
            },
            "required": ["target"]
          }
        },
        {
          "if": { "properties": { "action": { "const": "eval_sync" } } },
          "then": {
            "properties": {
              "expression": { "type": "string", "description": "ES5 JS expression evaluated synchronously via CDP." }
            },
            "required": ["expression", "assert"]
          }
        },
        {
          "if": { "properties": { "action": { "const": "eval_async" } } },
          "then": {
            "properties": {
              "expression": { "type": "string", "description": "ES5 JS expression returning a Promise. Use .then() chains, NOT await." }
            },
            "required": ["expression", "assert"]
          }
        },
        {
          "if": { "properties": { "action": { "const": "eval_ref" } } },
          "then": {
            "properties": {
              "ref": { "type": "string", "description": "Eval ref name (e.g. 'positions', 'core/tpsl-orders')." }
            },
            "required": ["ref", "assert"]
          }
        },
        {
          "if": { "properties": { "action": { "const": "press" } } },
          "then": {
            "properties": {
              "test_id": { "type": "string", "description": "testID prop of the React component to press." }
            },
            "required": ["test_id"]
          }
        },
        {
          "if": { "properties": { "action": { "const": "scroll" } } },
          "then": {
            "properties": {
              "test_id": { "type": "string", "description": "testID of the scrollable container." },
              "offset": { "type": "number", "default": 300, "description": "Scroll offset in pixels." },
              "animated": { "type": "boolean", "default": false }
            }
          }
        },
        {
          "if": { "properties": { "action": { "const": "set_input" } } },
          "then": {
            "properties": {
              "test_id": { "type": "string", "description": "testID of the TextInput." },
              "value": { "type": "string", "description": "Text to type into the input." }
            },
            "required": ["test_id", "value"]
          }
        },
        {
          "if": { "properties": { "action": { "const": "type_keypad" } } },
          "then": {
            "properties": {
              "value": { "type": "string", "description": "Digits/dot to type via keypad buttons (e.g. '10.5')." }
            },
            "required": ["value"]
          }
        },
        {
          "if": { "properties": { "action": { "const": "clear_keypad" } } },
          "then": {
            "properties": {
              "count": { "type": "number", "default": 8, "description": "Number of delete presses." }
            }
          }
        },
        {
          "if": { "properties": { "action": { "const": "call" } } },
          "then": {
            "properties": {
              "ref": { "type": "string", "description": "Flow path: 'team/name' or just 'name' (defaults to perps team)." },
              "params": { "type": "object", "description": "Values for the referenced flow's {{param}} tokens." }
            },
            "required": ["ref"]
          }
        },
        {
          "if": { "properties": { "action": { "const": "log_watch" } } },
          "then": {
            "properties": {
              "window_seconds": { "type": "number", "default": 10 },
              "must_not_appear": { "type": "array", "items": { "type": "string" }, "description": "Strings that must NOT appear in recent logs (case-insensitive)." },
              "watch_for": { "type": "array", "items": { "type": "string" }, "description": "Strings to count in recent logs (informational)." }
            }
          }
        },
        {
          "if": { "properties": { "action": { "const": "wait" } } },
          "then": {
            "properties": {
              "ms": { "type": "number", "default": 1000, "description": "Milliseconds to pause." }
            }
          }
        },
        {
          "if": { "properties": { "action": { "const": "screenshot" } } },
          "then": {
            "required": ["filename"],
            "properties": {
              "filename": { "type": "string", "minLength": 1, "description": "Screenshot label." },
              "note": {
                "type": "string",
                "minLength": 3,
                "description": "State-specific caption describing what the screenshot proves (e.g. 'AC1: Recent Activity skeleton with 3 shimmer rows'). Required when top-level schema_version is set (>= 1). Recipes without schema_version (legacy) only get a console warning."
              }
            }
          }
        },
        {
          "if": { "properties": { "action": { "const": "manual" } } },
          "then": {
            "properties": {
              "note": { "type": "string", "description": "Instructions for human intervention." }
            }
          }
        },
        {
          "if": { "properties": { "action": { "const": "select_account" } } },
          "then": {
            "properties": {
              "address": { "type": "string", "description": "Ethereum address to switch to." }
            },
            "required": ["address"]
          }
        },
        {
          "if": { "properties": { "action": { "const": "toggle_testnet" } } },
          "then": {
            "properties": {
              "enabled": { "type": "boolean", "default": true, "description": "Desired testnet state." }
            }
          }
        },
        {
          "if": { "properties": { "action": { "const": "switch_provider" } } },
          "then": {
            "properties": {
              "provider": { "type": "string", "description": "Provider ID (hyperliquid, myx, aggregated)." }
            },
            "required": ["provider"]
          }
        },
        {
          "if": { "properties": { "action": { "const": "wait_for" } } },
          "then": {
            "properties": {
              "expression": { "type": "string", "description": "ES5 JS expression to poll (sync or async with .then()). Used when route/test_id sugar is not sufficient." },
              "route": { "type": "string", "description": "Shorthand: poll until current route name equals this value. Expands to a getRoute() expression + eq assert." },
              "not_route": { "type": "string", "description": "Shorthand: poll until current route name does NOT equal this value (e.g. wait to leave a screen)." },
              "test_id": { "type": "string", "description": "Shorthand: poll until a component with this testID exists (or disappears if visible=false) in the React fiber tree." },
              "visible": { "type": "boolean", "default": true, "description": "Used with test_id: true = wait for element to appear, false = wait for element to disappear." },
              "timeout_ms": { "type": "number", "default": 10000, "description": "Max wait in milliseconds before failing." },
              "poll_ms": { "type": "number", "default": 500, "description": "Polling interval in milliseconds." }
            }
          }
        }
      ]
    }
  }
}
